,Date,Location,Dead,Injured,Total,Description,State,Year
0,"December 6, 2023","Paradise, Nevada",4,3,7,"2023 University of Nevada, Las Vegas shooting: A gunman opened fire at the UNLV campus, killing three people and injuring one person before being killed in a shootout with police.", Nevada,2023
1,"December 5, 2023","Austin, Texas/Bexar County, Texas",6,3,9,2023 Austin shootings: A suspect killed four people and injured three others in a shooting in Austin. Another shooting in Bexar County that killed two was also connected to the suspect., Texas,2023
2,"October 29, 2023","Tampa, Florida",2,16,18,2023 Ybor City shooting: Two people were killed and sixteen were injured in a street fight after a Halloween party in the Ybor City neighborhood.[30], Florida,2023
3,"October 29, 2023","Chicago, Illinois",0,15,15,2023 Chicago Halloween party shooting: Fifteen people were shot at a venue hosting a Halloween party., Illinois,2023
4,"October 25, 2023","Lewiston, Maine",19,13,32,"2023 Lewiston shootings: A shooter opened fire at a bowling alley and a local bar, killing 18 people and injuring 13 others. He was found dead from an apparent self-inflicted gunshot wound two days later.[31][32][33]", Maine,2023
5,"August 26, 2023","Jacksonville, Florida",4,0,4,"2023 Jacksonville shooting: A racist gunman armed with a rifle and handgun opened fire at a Dollar General, killing three people before committing suicide.[34]", Florida,2023
6,"August 23, 2023","Trabuco Canyon, California",4,6,10,"2023 Trabuco Canyon shooting: A former police officer shot and wounded his ex-wife before opening fire on random people at the Cook's Corner bar, killing three people and wounding six others. The gunman was killed by police.[35]", California,2023
7,"July 14, 2023","Fargo, North Dakota",2,3,5,"2023 shooting of Fargo police officers: A man shot at police officers responding to an unrelated traffic collision, killing one officer and wounding two more before an officer shot and killed him. In addition, a nearby woman was struck by gunfire.[36]", North Dakota,2023
8,"July 3, 2023","Philadelphia, Pennsylvania",5,2,7,"2023 Kingsessing shooting: Five people were killed and two others injured in the Kingsessing section of Southwest Philadelphia.[37][38] A 40-year-old suspect allegedly carrying an AR-15–style rifle, a handgun, and a scanner was arrested.[39]", Pennsylvania,2023
9,"July 2, 2023","Baltimore, Maryland",2,28,30,2023 Baltimore shooting: Two people were killed and 28 people were injured in South Baltimore., Maryland,2023
10,"June 15, 2023","Monroe Township, Ohio",3,1,4,2023 Doerman killings: Three boys were killed and their mother wounded in a domestic-related shooting. The father was charged with the killings.[40], Ohio,2023
11,"June 11, 2023","Annapolis, Maryland",3,3,6,"2023 Annapolis shooting: A man fired at neighbors following a dispute over a parking space, killing three people and wounding three others. A suspect was arrested.[41]", Maryland,2023
12,"June 6, 2023","Richmond, Virginia",2,5,7,"2023 Richmond shooting: Seven people were shot, two fatally, outside a downtown theater in Richmond, Virginia, where a high school graduation ceremony had just ended. Two suspects were arrested.", Virginia,2023
13,"May 15, 2023","Farmington, New Mexico",4,6,10,"2023 Farmington, New Mexico shooting: Three civilians were killed and at least six others, including two police officers, were injured after an 18-year-old man opened fire in the city of Farmington, New Mexico. The gunman was killed by police.[42]", New Mexico,2023
14,"May 6, 2023","Allen, Texas",9,7,16,"2023 Allen, Texas mall shooting: A man opened fire at the Allen Premium Outlets, killing eight people, and injuring at least seven others before being killed by police.[43]", Texas,2023
15,"May 3, 2023","Atlanta, Georgia",1,4,5,"2023 Atlanta shooting: A man opened fire inside a Northside Hospital facility in Midtown Atlanta, killing a 39-year-old woman, and injuring four others, before fleeing the scene. After eight hours of being on the run, the suspect was arrested by police without further incident.[44][45]", Georgia,2023
16,"May 1, 2023","Henryetta, Oklahoma",7,0,7,"2023 Henryetta killings: A sex offender killed six people, including four family members, before killing himself at his residence.[46]", Oklahoma,2023
17,"April 28, 2023","Cleveland, Texas",5,0,5,"2023 Cleveland, Texas shooting: A man armed with an AR-15-style rifle opened fire at a home, killing five people, including a child, before fleeing the scene. Three children were covered in blood, but were hospitalized.[47] The suspect, 38-year-old Francisco Oropeza, was captured after a 4-day-long manhunt.[48]", Texas,2023
18,"April 18, 2023","Bowdoin and Yarmouth, Maine",4,3,7,"2023 Bowdoin–Yarmouth shootings: Four people were killed at a home in Bowdoin, followed by a shooting on a highway in Yarmouth that wounded three family members in the same vehicle. The son of two of the victims in Bowdoin was charged with the shooting.", Maine,2023
19,"April 15, 2023","Dadeville, Alabama",4,32,36,"2023 Dadeville shooting: Gunmen opened fire at a birthday party, killing four people, and injuring 32 others. Six suspects were taken into custody.[49][50]", Alabama,2023
20,"April 10, 2023","Louisville, Kentucky",6,8,14,"2023 Louisville bank shooting: An employee opened fire at a bank, killing five people and injuring eight others, including a police officer that was critically wounded.[51] The perpetrator, 25-year-old Connor Sturgeon, was fatally shot by police.[52]", Kentucky,2023
21,"March 27, 2023","Nashville, Tennessee",7,1[n 4],8,"2023 Nashville school shooting: A former student opened fire at The Covenant School in the Green Hills neighborhood. Six people were killed, three of them children, and one police officer was injured by shattered glass. The perpetrator, 28-year-old Aiden Hale, was fatally shot by police.[53]", Tennessee,2023
22,"February 22, 2023","Pine Hills, Florida",3,2,5,Killing of Dylan Lyons: Three people were killed and two others wounded in a series of shootings. A 19-year-old suspect was arrested.[54], Florida,2023
23,"February 13, 2023","East Lansing, Michigan",4,5,9,2023 Michigan State University shooting: A mass shooting occurred at Michigan State University in East Lansing. Three people were killed and five others injured.[55] The shooter died of a self-inflicted gunshot wound after being cornered by police.[56], Michigan,2023
24,"January 23, 2023","Half Moon Bay, California",7,1,8,"2023 Half Moon Bay shootings: A man opened fire at two farms, killing seven people and injuring one other, before being taken into custody.[57]", California,2023
25,"January 21, 2023","Monterey Park, California",12,9,21,2023 Monterey Park shooting: Eleven people were killed and nine others injured after a gunman opened fire at a dance studio in Monterey Park after a Chinese New Year celebration in the city. The perpetrator shot and killed himself in a standoff with police the next day.[58], California,2023
26,"January 16, 2023","Goshen, California",6,0,6,"2023 Goshen shooting: A baby, a teenager, and four others were killed in a shooting at a home.[59]", California,2023
27,"January 4, 2023","Enoch, Utah",8,0,8,"2023 Enoch, Utah shooting: Five children and three adults were killed in a shooting at a home.[60]", Utah,2023
0,"September 7, 2024","Laurel County, Kentucky",0,5,5,Interstate 75 Kentucky shooting: Five people were shot and injured when a lone gunman shot civilians in passing by cars on the Interstate 75 in Kentucky. Three other people suffered injuries due to vehicle accidents caused by the shooting.[9][10][11], Kentucky,2024
1,"September 4, 2024","Winder, Georgia",4,9,13,2024 Apalachee High School shooting: At least four people were killed and nine others were wounded in a shooting at Apalachee High School. A male suspect was taken into custody.[12], Georgia,2024
2,"September 2, 2024","Forest Park, Illinois",4,0,4,2024 CTA shooting: Four people were fatally shot on a Chicago Transit Authority Blue Line train as it entered the Forest Park station.[13], Illinois,2024
3,"July 13, 2024","Meridian, Pennsylvania",2,3,5,"Attempted assassination of Donald Trump: A man opened fire on former President of the United States Donald Trump during a rally from a nearby rooftop, killing an audience member and wounding Trump and two other audience members. The shooter was killed by Secret Service personnel.[14]", Pennsylvania,2024
4,"July 6, 2024","Florence, Kentucky",5,3,8,2024 Florence shooting: 21-year-old Chase Garvey killed four and wounded three others at a residence before fleeing in a vehicle; he crashed into a ditch and committed suicide during a police pursuit.[15][16], Kentucky,2024
5,"June 23, 2024","Tampa, Florida",1,3,4,Killing of Julio Foolio: Jacksonville-based rapper Julio Foolio was killed and three others were injured in an 'ambush' shooting at the Holiday Inn parking lot near the University of South Florida campus.[17][18], Florida,2024
6,"June 21, 2024","Fordyce, Arkansas",4,10[n 1],14,"2024 Fordyce shooting: A 44-year-old man opened fire at the Mad Butcher Grocery Store, killing four civilians and injuring nine others, including two police officers. The suspect, identified as Travis Posey from a neighboring county, suffered a graze wound after being shot by police.[19]", Arkansas,2024
7,"June 15, 2024","Rochester Hills, Michigan",1,9,10,2024 Rochester Hills shooting: A 42-year-old man from another county randomly shot nine people including two children at the Brooklands Plaza Splash Pad before driving to his home and shooting himself.[20], Michigan,2024
8,"May 30, 2024","Minneapolis, Minnesota",4,3,7,"2024 Minneapolis shooting: A man in the Whittier neighborhood killed three people, including a responding officer, and wounded three more before being killed by police.[21][22]", Minnesota,2024
9,"April 29, 2024","Charlotte, North Carolina",5,4,9,"2024 Charlotte shootout: Four law enforcement officers were shot and killed and four others wounded after a suspect fired at a task force serving an arrest warrant for a man. The subject of the warrant, who was later identified as 39-year-old Terry Clark Hughes Jr., was also killed.[23][24]", North Carolina,2024
10,"February 18, 2024","Burnsville, Minnesota",4,1,5,"2024 Burnsville shooting: Police and medics were fired upon from a home while responding to a domestic incident. Two officers and a firefighter were killed while another officer suffered a gunshot wound.[25] After opening fire on first responders, the shooter fatally shot himself.[26]", Minnesota,2024
11,"February 14, 2024","Kansas City, Missouri",1,40[n 2],41,"2024 Kansas City parade shooting: Gunfire erupted during a parade at Kansas City Union Station to celebrate the Kansas City Chiefs winning Super Bowl LVIII. At least one person was killed and more than twenty others were injured. Three male suspects were detained, two of whom are juveniles and one of whom was shot.", Missouri,2024
12,"February 7, 2024","East Lansdowne, Pennsylvania",6,2,8,"2024 East Lansdowne shooting: A man killed his niece and shot two police officers before setting his house on fire, killing himself and four other relatives.[27]", Pennsylvania,2024
13,"January 21–22, 2024","Joliet, Illinois",9,1,10,"2024 Joliet shootings: A gunman opened fire at two homes, killing seven people. The gunman previously opened fire at two locations, killing a man and injuring one person, before fatally shooting himself in a confrontation with law enforcement officials near Natalia, Texas.", Illinois,2024
14,"January 4, 2024","Perry, Iowa",3,6,9,"Perry High School shooting: A 17-year-old male opened fire at Perry High School, killing one student and injuring seven others, including a school administrator, before committing suicide. The principal of the school, who was wounded during the incident, died from his wounds ten days later on January 14.[28][29]", Iowa,2024
