,Date,Location,Dead,Injured,Total,Description,State,Year
2,"October 1, 2017","Paradise, Nevada",61,411,472,"2017 Las Vegas shooting: A man on the 32nd floor of a hotel opened fire on a country music festival happening outside, killing 60 people and injuring 867 others, with 411 of them suffering from gunshot wounds. The man then killed himself.[127][128][129][130][131]", Nevada,2017
3,"September 24, 2017","Antioch, Tennessee",1,8[n 1],9,"Burnette Chapel shooting: A man killed a woman outside the Burnette Chapel Church of Christ before entering the chapel and wounding seven others. During a struggle with an usher, the man shot himself in the chest. The usher ran to his car to get his own pistol and held the man at gunpoint until police arrived to arrest him.[132]", Tennessee,2017
4,"September 10, 2017","Plano, Texas",9,1,10,"2017 Plano shooting: A man entered his ex-wife's home while she was hosting a football-watching party and killed her and seven others, and wounded one other. He was killed by police.[133]", Texas,2017
5,"August 28, 2017","Clovis, New Mexico",2,4,6,Clovis library shooting: A sixteen-year-old killed two people and wounded four others at a public library before surrendering to police.[134], New Mexico,2017
6,"July 1, 2017","Little Rock, Arkansas",0,28,28,Little Rock nightclub shooting: Twenty-eight people were injured (twenty-five directly by gunfire) when shooting broke out in a nightclub where rapper Finese 2Tymes was performing.[135], Arkansas,2017
7,"June 30, 2017","New York City, New York",2,6,8,Bronx-Lebanon Hospital attack: A former hospital employee killed a doctor and wounded six others before he committed suicide., New York,2017
8,"June 14, 2017","San Francisco, California",4,5,9,"San Francisco UPS shooting: A gunman entered his workplace and singled out coworkers, killing three and wounding five, before committing suicide.[136]", California,2017
9,"June 14, 2017","Alexandria, Virginia",1,6,7,"Congressional baseball shooting: A gunman shot and wounded four people, including Republican Congressman and House Majority Whip Steve Scalise, while they were practicing for the Congressional Baseball Game. Two others were also injured in other ways. The gunman was killed after being engaged by Capitol police officers assigned to protect Scalise and by police officers responding to the scene.[137]", Virginia,2017
10,"June 8, 2017","Eaton Township, Pennsylvania",4,0,4,Eaton Township Weis Markets shooting: An employee of a Weis Markets supermarket who was working a night shift barricaded the exits and killed three coworkers before killing himself.[138], Pennsylvania,2017
11,"June 6, 2017","Sandy, Utah",3,2,5,"Sandy, Utah attack: A man rammed a vehicle containing his ex-girlfriend, three children and one other adult, opened fire, killing two and wounding two, then committed suicide.[139]", Utah,2017
12,"June 5, 2017","Orlando, Florida",6,0,6,Orlando factory shooting: A former employee entered the factory through a rear exit and killed five employees and then himself.[140], Florida,2017
13,"May 27, 2017","Lincoln County, Mississippi",8,1[n 1],9,"2017 Mississippi shootings: A man killed eight people, including several family members and a sheriff's deputy, at three separate houses. He was injured by police and then arrested. The shooter later said he had intended to commit suicide by cop.[141]", Mississippi,2017
14,"May 12, 2017","Kirkersville, Ohio",4,0,4,"Kirkersville shooting: After taking two people hostage, a man shot and killed a police officer and two nurses at a nursing home before he killed himself.", Ohio,2017
15,"March 26, 2017","Cincinnati, Ohio",2,16,18,Cincinnati nightclub shooting: Two men were killed and sixteen people were wounded after a fight escalated into a shooting at a crowded nightclub. One person was arrested.[142], Ohio,2017
16,"January 6, 2017","Broward County, Florida",5,6,11,"Fort Lauderdale airport shooting: A man killed five people and injured six in a shooting at Fort Lauderdale–Hollywood International Airport before running out of ammunition and lying on the ground to surrender to police. Thirty to forty other people were also hurt, with injuries not directly caused by gunfire.[143]", Florida,2017
0,"November 11, 2018","Globe, Arizona",3,1,4,"Globe, Arizona shooting: A gunman shot four people outside a bar, three fatally, before fleeing the scene. He was later taken into custody.[98]", Arizona,2018
1,"November 11, 2018","Robbins, Illinois",1,4[n 1],5,"Shooting of Jemel Roberson: A man re-entered a bar after being ejected and began to fire, wounding three people and becoming injured himself. Armed security guards apprehended the suspect. Responding officers saw one of the security guards with a gun, and shot and killed him.[99]", Illinois,2018
2,"November 7, 2018","Thousand Oaks, California",13,16,29,"Thousand Oaks shooting: A man entered a bar hosting a student line-dancing event and killed 12 people, including a police officer. 16 other people were injured, one of them by gunfire. The gunman then killed himself.[100][101]", California,2018
3,"November 2, 2018","Tallahassee, Florida",3,5[n 6],8,"2018 Tallahassee shooting: A man entered a yoga studio and killed two women and injured five others; four by gunshots and one by pistol-whipping, before committing suicide.[102]", Florida,2018
4,"October 27, 2018","Pittsburgh, Pennsylvania",11,7[n 1],18,"Pittsburgh synagogue shooting: A man opened fire in the Tree of Life synagogue in an antisemitic attack, killing 11 people and injuring six others (including four police officers). The suspect, 46-year-old Robert G. Bowers, was taken into custody by police.[103][104]", Pennsylvania,2018
5,"October 3, 2018","Florence, South Carolina",2,10,12,"Florence shooting: Officers were shot at during a two-hour standoff while attempting to execute a search warrant. The perpetrator held children hostage, killing one and wounding seven before being arrested.[105]", South Carolina,2018
6,"September 20, 2018","Aberdeen, Maryland",4,3,7,Aberdeen shooting: An employee of the Rite Aid Distribution facility killed three victims before wounding herself. The shooter died later in the hospital.[106], Maryland,2018
7,"September 6, 2018","Cincinnati, Ohio",4,2,6,"2018 Cincinnati shooting: A gunman entered a loading dock at the Fifth Third Center skyscraper and opened fire before entering the lobby of a building. Four people, including the shooter, were killed and two were injured.[107]", Ohio,2018
8,"August 26, 2018","Jacksonville, Florida",3,11,14,"Jacksonville Landing shooting: A gunman killed two people and wounded eleven more (nine with gunshot wounds) at a Madden NFL 19 competition before killing himself. The shooter was identified as David Katz, an individual who had reportedly been eliminated from the competition before the shooting.[108][109][110]", Florida,2018
9,"June 28, 2018","Annapolis, Maryland",5,2,7,Capital Gazette shooting: A gunman entered the offices of The Capital Gazette and killed five employees and wounded two others.[111][112], Maryland,2018
10,"June 17, 2018","Trenton, New Jersey",1,22[n 2][n 14],23,Art All Night shooting: Several gunmen wounded 17 people at the Art All Night festival. Five others were wounded when they were trampled by people around them. One of the suspected gunmen was shot and killed by police. Police suspect the shooting was gang-related.[113], New Jersey,2018
11,"May 30–June 4, 2018","Scottsdale, Arizona",7,0,7,"2018 Scottsdale shootings: Over the course of several days, a man killed a forensic psychiatrist, two paralegals, a counselor, and a couple from whom he took a handgun. The suspect killed himself when police began closing in on him.[114][115]", Arizona,2018
12,"May 18, 2018","Santa Fe, Texas",10,14[n 1],24,"2018 Santa Fe High School shooting: A student at Santa Fe High School shot and killed 10 people and wounded 14 others. Explosive devices were also found, but they were not detonated. The suspect was taken into custody by police.[116]", Texas,2018
13,"April 22, 2018","Nashville, Tennessee",4,2,6,"Nashville Waffle House shooting: A gunman entered a Waffle House, where he killed four people and injured two others. He was later taken into custody.[117]", Tennessee,2018
14,"April 3, 2018","San Bruno, California",1,4[n 15],5,"YouTube headquarters shooting: A woman approached an outdoor patio at YouTube Headquarters and wounded three people before committing suicide, a fourth person was injured in the evacuation.[118]", California,2018
15,"March 9, 2018","Yountville, California",5,0,5,"Yountville shooting: A man entered the Veterans Home of California and held three staff members hostage. He killed the three staff members (and the unborn child of one of the staff members, who was pregnant) before killing himself in a murder–suicide.[119]", California,2018
16,"February 14, 2018","Parkland, Florida",17,17,34,"Parkland High School shooting: A former student of Marjory Stoneman Douglas High School entered the school, 19-year-old Nikolas Cruz, killed 17 people, and wounded 17 others. He was taken into custody by police. On October 13, 2022, he was sentenced to life in prison without the possibility of parole.[120][121]", Florida,2018
17,"January 23, 2018","Benton, Kentucky",2,16,18,2018 Marshall County High School shooting: A fifteen-year-old student killed two other students and injured sixteen others before discarding his weapon and attempting to hide among other students. He was apprehended by police.[122], Kentucky,2018
0,"December 10, 2019","Jersey City, New Jersey",6,3,9,"2019 Jersey City shooting: An officer approached a vehicle suspected of being used in a murder previously, he was shot and killed. In the resulting suspect chase and police confrontation the two suspects were killed, along with three other civilians, a civilian and two cops were wounded as well. The attack in question was committed by a Black Hebrew Israelite and targeted Jews living in Jersey City.", New Jersey,2019
1,"December 6, 2019","Pensacola, Florida",4,8,12,Naval Air Station Pensacola shooting: Three people were killed and 8 others were injured at a US Navy base. The suspect was killed by police., Florida,2019
2,"December 5, 2019","Miramar, Florida",4,1,5,"2019 Miramar shootout: Two suspects robbed a jewelry store which resulted in a police shootout that killed 2 people,[90] including a UPS truck driver who was on his 1st day on the job. Both suspects were killed by police.", Florida,2019
3,"November 17, 2019","Fresno, California",4,6,10,"2019 Fresno shooting: Ten people were shot, four fatally, at a football watch party.", California,2019
4,"November 14, 2019","Santa Clarita, California",3,3,6,2019 Saugus High School shooting: Two people were killed and three others were injured. The gunman then eventually committed suicide., California,2019
5,"October 31, 2019","Orinda, California",5,4,9,"Orinda shooting: An overnight block party attended by over 100 people ended with five people killed, and four more wounded by gunfire.", California,2019
6,"October 14, 2019","San Juan, Puerto Rico",6,0,6,2019 Río Piedras shooting: Six people were killed after a shootout near an apartment complex., Puerto Rico,2019
7,"August 4, 2019","Dayton, Ohio",10,27[n 12],37,"2019 Dayton shooting: A gunman shot 26 people, killing 9, including his transgender sibling, and wounding 17 others outside of a bar. Ten others were wounded as they fled the scene. The perpetrator was killed by police after the first shots were fired in 32 seconds.", Ohio,2019
8,"August 3, 2019","El Paso, Texas",23,22,45,"2019 El Paso shooting: A gunman shot 45 people, killing 23 and wounding 22 others at a Walmart Supercenter near the Cielo Vista Mall. The attack was a hate crime targeting Hispanic immigration and was influenced by the Christchurch mosque shootings. The perpetrator was arrested by police.", Texas,2019
9,"July 28, 2019","Gilroy, California",4,15,19,"Gilroy Garlic Festival shooting: A gunman killed three people, including a 6-year-old boy, attending Gilroy's annual Garlic Festival; 12 more people were injured. The shooter killed himself.", California,2019
10,"May 31, 2019","Virginia Beach, Virginia",13,4,17,2019 Virginia Beach shooting: A gunman killed 12 people and injured four others at a municipal building. The gunman was killed by police.[91], Virginia,2019
11,"May 7, 2019","Highlands Ranch, Colorado",1,8,9,"2019 STEM School Highlands Ranch shooting: A school shooting was reported at STEM School Highlands Ranch, around 1:50 p.m, two shooters targeted separate locations and killed one student and injured eight more before being arrested.[92]", Colorado,2019
12,"April 30, 2019","Charlotte, North Carolina",2,4,6,"2019 University of North Carolina at Charlotte shooting: Six people were shot, two fatally, on the last day of classes at the University of North Carolina at Charlotte. The student gunman was taken into custody after he ran out of ammunition.[93]", North Carolina,2019
13,"April 27, 2019","Poway, California",1,3,4,Poway synagogue shooting: One person was killed and at least three were wounded by a shooter at the Chabad of Poway synagogue.[94] The gunman was influenced by the Christchurch mosque shootings in New Zealand and claimed responsibility for the Escondido mosque fire the month prior, California,2019
14,"February 15, 2019","Aurora, Illinois",6,6,12,"Aurora, Illinois shooting: A 45-year-old man opened fire at a Henry Pratt Company plant and killed five people and injured six others. He was a former worker at the plant and he was killed in a shootout with police.", Illinois,2019
15,"January 28, 2019","Houston, Texas",2,5,7,Harding Street raid: Two homeowners were killed and five Houston Police Department officers wounded in a shootout during a no-knock raid.[95], Texas,2019
16,"January 26, 2019","Ascension and Livingston Parish, Louisiana",5,0,5,"January 2019 Louisiana shootings: A 21-year-old man killed five people, including his parents, in two parishes in Louisiana.[96]", Louisiana,2019
17,"January 23, 2019","Sebring, Florida",5,0,5,2019 Sebring shooting: Five people were killed in a hostage incident and shooting at a bank. The suspect was taken into custody by police.[97], Florida,2019
0,"December 8, 2020","Williamsburg, West Virginia",6,0,6,2020 Williamsburg massacre: A mother killed her five children with a shotgun before killing herself., West Virginia,2020
1,"November 20, 2020","Wauwatosa, Wisconsin",0,8,8,Mayfair Mall shooting: Eight people were hospitalized with non-life-threatening injuries after a person opened fire at the Mayfair Mall., Wisconsin,2020
2,"November 3, 2020","Henderson, Nevada",4,1,5,Henderson shooting: Three people were killed and one person was injured when a gunman opened fire at an apartment complex. The gunman was killed by police., Nevada,2020
3,"September 19, 2020","Rochester, New York",2,14,16,Rochester shooting: Two people were killed and fourteen others injured after a shooting at a party in Rochester., New York,2020
4,"March 15, 2020","Springfield, Missouri",5,2,7,"2020 Springfield, Missouri shooting: A man committed a series of random drive-by shootings before crashing his vehicle at a gas station. He entered the business, where he killed four people and wounded two others before committing suicide.[89]", Missouri,2020
5,"February 26, 2020","Milwaukee, Wisconsin",6,0,6,"Milwaukee brewery shooting: Five people were killed when a gunman opened fire at the local Molson Coors Beverage Company campus, where he had been employed. Afterwards, the gunman committed suicide.", Wisconsin,2020
6,"January 17, 2020","Grantsville, Utah",4,1,5,Haynie family murders: Four members of a family were killed and one was injured after a teenager fired at his family as they returned home., Utah,2020
0,"December 27, 2021","Denver/Lakewood, Colorado",6,2,8,"2021 Denver and Lakewood shootings: A gunman traveled to multiple businesses and homes, where he killed five people and wounded two others before being shot dead by police.[80]", Colorado,2021
1,"November 30, 2021","Oxford, Michigan",4,7,11,"2021 Oxford High School shooting: A shooter, a student at the school, opened fire on students, killing three and wounding seven students and a teacher before being arrested. One of the injured died afterwards.[81]", Michigan,2021
2,"September 23, 2021","Collierville, Tennessee",2,14,16,"Collierville Kroger shooting: A shooter opened fire in a Kroger, killing one and injuring 14, before taking his own life.[82]", Tennessee,2021
3,"May 30, 2021","Hialeah, Florida",3,20,23,"2021 Hialeah shooting: Three shooters stepped out of a SUV, and opened fire at concert goers, killing three and wounding 20 others.[83]", Florida,2021
4,"May 26, 2021","San Jose, California",10,0,10,"2021 San Jose shooting: Nine people were killed at a Santa Clara Valley Transportation Authority (VTA) rail yard in San Jose, California. after police arrived, The gunman committed suicide.[84][85]", California,2021
5,"April 15, 2021","Indianapolis, Indiana",9,7,16,Indianapolis FedEx shooting: Nine people were killed and seven others were wounded after a mass shooting at a FedEx facility. The shooter took his own life., Indiana,2021
6,"March 31, 2021","Orange, California",4,2[n 1],6,"2021 Orange, California office shooting: Four people, including a child, were killed at an Orange office complex.", California,2021
7,"March 22, 2021","Boulder, Colorado",10,2[n 1],12,"2021 Boulder shooting: A mass shooting occurred at a King Soopers supermarket in Boulder, Colorado, which left 10 people dead, including an on-duty police officer.", Colorado,2021
8,"March 16, 2021","Atlanta and Cherokee County, Georgia",8,1,9,"2021 Atlanta spa shootings: A series of mass shootings occurred at massage parlors in the Atlanta, Georgia metropolitan area. Eight people were killed in the incidents and one person was wounded.", Georgia,2021
9,"February 9, 2021","Buffalo, Minnesota",1,4,5,"Buffalo, Minnesota clinic attack: A nurse was killed and four other people were shot and seriously wounded inside of a health care clinic. The suspect, 67-year-old Gregory Paul Ulrich, was taken into police custody.[86][87]", Minnesota,2021
10,"February 2, 2021","Muskogee, Oklahoma",6,1,7,"2021 Muskogee shooting: Five children and one adult were shot and killed, and one other adult suffered life-threatening injuries, after a home shooting in Oklahoma. Suspect, 25-year-old Jarron Pridgeon, is currently under custody.[88]", Oklahoma,2021
11,"February 2, 2021","Sunrise, Florida",3,3,6,"2021 Sunrise, Florida shootout: Two FBI agents were shot and killed and three others wounded attempting to serve a warrant. The suspect barricaded himself in his home and opened fire before shooting and killing himself.", Florida,2021
12,"January 9, 2021","Chicago and Evanston, Illinois",6,2,8,"2021 Chicago–Evanston shootings: 32-year-old Jason Nightengale shot 8 people at random, killing 5, before being fatally shot by police.", Illinois,2021
0,"November 22, 2022","Chesapeake, Virginia",7,4,11,"2022 Chesapeake shooting: Six people were killed, and four others were injured, when a night-shift manager opened fire at a Walmart. The gunman then committed suicide.[61]", Virginia,2022
1,"November 19–20, 2022","Colorado Springs, Colorado",5,26[n 1][n 5],31,"Colorado Springs nightclub shooting: A gunman killed five after entering a local gay bar. 26 others, including the gunman, were wounded during the attack, 19 of them by gunfire. A suspect was later taken into custody.", Colorado,2022
2,"November 13, 2022","Charlottesville, Virginia",3,2,5,"2022 University of Virginia shooting: A student at the University of Virginia opened fire on a bus returning from a trip to see a play. The three people killed as well as one of the wounded were members of the University of Virginia's football team, and the gunman was a member of the team for one season, though he did not play any games.", Virginia,2022
3,"October 24, 2022","St. Louis, Missouri",3,7[n 6],10,"2022 Central Visual and Performing Arts High School shooting: A shooter, a former student, opened fire, killing two people and wounding four others before being shot and killed by police.[62]", Missouri,2022
4,"October 13, 2022","Raleigh, North Carolina",5,2,7,"2022 Raleigh shootings: The shooter, a teenager, went on a shooting spree along the Neuse River Trail greenway and surrounding neighborhood.[63]", North Carolina,2022
5,"September 28, 2022","Oakland, California",1,5,6,2022 Oakland school shooting: Four staff members and two students were shot by multiple gunmen at a complex that houses multiple schools. The shooting may have been tied to gang violence.[64], California,2022
6,"August 28, 2022","Bend, Oregon",3,2,5,"2022 Bend, Oregon shooting: A local man shot four people, two fatally, in a Safeway supermarket at the Forum shopping center before committing suicide.", Oregon,2022
7,"July 17, 2022","Denver, Colorado",0,7,7,"2022 Denver police shooting: Three police officers fired on a fleeing suspect, wounding him and six bystanders. One officer was convicted of assault and sentenced to 18 months probation.[65]", Colorado,2022
8,"July 17, 2022","Greenwood, Indiana",4,2,6,Greenwood Park Mall shooting: A local man fatally shot three people and injured two others at the food court in the Greenwood Park Mall before being shot dead by an armed civilian., Indiana,2022
9,"July 4, 2022","Highland Park, Illinois",7,48,55,Highland Park parade shooting: Seven people were killed and 48 others injured after a man fired a rifle from a rooftop at spectators attending Highland Park's Fourth of July parade., Illinois,2022
10,"June 30, 2022","Allen, Kentucky",3,4,7,"2022 shooting of Kentucky police officers: A man fired out the window of his home, shooting seven people, six of whom were law enforcement officers. Two of the officers died at the scene, and a third died in the hospital the day after. The third officer was a canine handler, and his dog also died. The suspect later killed himself in jail.", Kentucky,2022
11,"June 5, 2022","Chattanooga, Tennessee",3,14[n 8],17,"2022 Chattanooga shooting: Twelve people were shot, two of them fatally, at a nightclub during the early morning. A third person was killed by a vehicle attempting to flee.[66]", Tennessee,2022
12,"June 4, 2022","Philadelphia, Pennsylvania",3,11[n 2],14,"2022 Philadelphia shooting: Fourteen people were shot, three of them fatally, by multiple shooters on South Street. One of the shooters may have been shot by a responding police officer.[67]", Pennsylvania,2022
13,"June 2, 2022","Centerville, Texas/Jourdanton, Texas",6,0,6,"Centerville shooting: An escaped prisoner went inside a home and opened fire, killing five members of a family before being shot and killed by police.[68]", Texas,2022
14,"June 1, 2022","Tulsa, Oklahoma",5,0,5,2022 Tulsa hospital shooting: Four people were killed following a mass shooting at a Saint Francis medical building. The gunman committed suicide.[69], Oklahoma,2022
15,"May 24, 2022","Uvalde, Texas",22,18,40,Uvalde school shooting: A local man shot and wounded his grandmother before driving to his former elementary school and opening fire. He killed nineteen children and two adults before being shot dead by police. Eighteen other people were hospitalized.[70], Texas,2022
16,"May 19, 2022","Chicago, Illinois",2,8,10,"Magnificent Mile shooting: Two people were fatally shot, and eight others were critically injured, in a shooting near a McDonald's restaurant in Chicago, Illinois.[71]", Illinois,2022
17,"May 15, 2022","Laguna Woods, California",1,5,6,"2022 Laguna Woods shooting: One person was fatally shot and five others were injured in a shooting at a church in Orange County, California.[72]", California,2022
18,"May 14, 2022","Buffalo, New York",10,3,13,"2022 Buffalo shooting: The shooter, 18-year-old Payton Gendron, who was clad in body armor and a white supremacist, opened fire at a Tops supermarket, killing ten people, all of whom were Black, including a security guard, and wounded three others.[73] On February 15, 2023, he was sentenced to life in prison without the possibility of parole. The gunman specifically targeted African-Americans and was influenced by similar terrorist incidents in Charleston, Pittsburgh, Christchurch, Poway and El Paso.", New York,2022
19,"April 17, 2022","Pittsburgh, Pennsylvania",2,13[n 10],15,2022 Pittsburgh shooting: An early morning shooting at a party held at an Airbnb rental property in the East Allegheny neighborhood killed two juveniles and wounded eight others. Five people sustained injuries such as broken bones and cuts when they jumped out of windows to escape the gunfire.[74], Pennsylvania,2022
20,"April 12, 2022","New York City, New York",0,29[n 11],29,"2022 New York City Subway attack: Ten people were shot when a gunman opened fire on a New York City Subway train as it approached the 36th Street station in the Sunset Park neighborhood. Immediately before the attack, the assailant donned a gas mask and threw smoke bombs. The incident caused 19 others to be injured as they fled. The attacker fled the scene and was arrested after police received a tip-off after a 30-hour manhunt. He was identified as 62-year-old Frank James.[75][76]", New York,2022
21,"April 3, 2022","Sacramento, California",6,12[n 2],18,2022 Sacramento shooting: A shooting in downtown Sacramento killed six people and injured twelve others.[77] A suspect was arrested the next day.[78], California,2022
22,"February 19, 2022","Portland, Oregon",1,5[n 1],6,"Normandale Park shooting: During a racial justice protest, a man confronted a group of protestors and engaged in an argument with them, before pulling out a gun and opening fire, killing one and wounding four others. One of the people in the group returned fire and wounded the perpetrator.[79]", Oregon,2022
